{
  "attempt_id": "20260827T090603Z",
  "backup_manifest_sha256": "93d7206401744b7c66e55800352f87a2204d084ae88119d3f6c5038b769f9fb5",
  "controller_exit_code": 1,
  "deletion_eligible": true,
  "evidence_sha256": "8adbed352c7e1799468262097225f84a4488736e98c294cce038e8f524b76986",
  "execution_sha256": "0c64a5c6d177598d590cc02775cec5f07698da97ece7e02460f0beb0c0fe9caa",
  "expected_prefix": "gs://ganesh-gate0-model-transfer-1061994342941/ganesh-mini-1.0/gate3/20260827T090603Z/runtime-terminal-20260827T090603Z",
  "run": null,
  "runtime_inventory_entries": 70,
  "runtime_inventory_sha256": "7a83fe9811dec38a5d3d440c3b2bc138836fc56301b10c62ee97cbc2d4a8baba",
  "schema_version": "ganesh-mini-gate3-terminal-validation/v2",
  "startup_exit_code": 1,
  "status": "sealed-failure",
  "terminal_object_count": 75
}
